name,Biography,last_name,creator image,location,latitude,longitude,roles,jobTitle,affiliation,location_name,iteration,sequence,year,title,body_y,references,makers
Juliette Vion-Dury,N/A,Vion-Dury,N/A,,,,['maker'],,,,19,6,2023,The Now.museum - The COVID19 museum timeline,"Authors: Andrea Scharnhorst, Vyacheslav Tykhonov, Juliette Vion-Dury, Yves Rozenholc, 

Link to Macroscope: <http://info126.pharmacie.univ-paris5.fr:8095/timeline?q=covid>

Abstract: 

We propose a general toolbox for the Now.museum - a ""digital space"" dedicated to individual and collective memories of significant events in our societies - whose context is informed by the collection and conservation of artifacts publicly available on the web. 
Clearly, Covid-19 and its global spreading belong to these significant events and could be documented by sharing digital collections across specific societal sectors, scientific domains, etc. However, a question is “how to capture its double spreading dimensionality spatially and in time”? Even if several retrospective initiatives exist, an integrative data curation approach and interface on information and testimonies is still missing. Moreover, relatively little attention was given to the ‘voices’ of the public, their testimonies, experiences, losses, and aspirations. 
Following the Open Science principle for science democratization, our macroscope – with its timeline interface -  answers these concerns with open data which provides context to individual experiences. Its infrastructural backbone consists in an open source archival platform (Dataverse) nourished from the capture of public parts of newspaper and social media, published in all Europe and in all languages since December 2019, including the term “Covid” in their title. 
The interface is designed as a searchable timeline, where captures are displayed as thumbnails, and sources as well as topics are color coded. The captures are indexed using AI techniques and links are provided to the original contents. The interactive interface is accompanied by a number of static overview maps, tracing bursts and changes in terminology, paying attention to geographic spread and multilinguality. 
The general design of the Now.museum as a space of cultural heritage, is applicable for any memory-collecting and sharing activity among the wider public, hence individual contributions are expected. To this end, a workflow is designed and a first implementation of ‘citizen/crowd material’ is given.

PS: Domain names Now.museum and Covid-19.museum are the ownership of Yves Rozenholc since the beginning of April 2020. Their denominations have been validated by the ICOM (International Council of Museums) which controls the extension museum.","A github repository  https://github.com/C19M/Covid-19.Museum describes the case, and contains links to the software code used. The timeline in essence runs on a Dataverse instance.

References around the Covid-19 Museum
Rozenholc Y., Covid-19 Museum ou comment agréger les traces laissées par la pandémie dans un musée virtuel, The Conversation (31 Janvier 2021).
https://theconversation.com/covid-19-museum-ou-comment-agreger-les-traces-laissees-par-la-pandemie-dans-un-musee-virtuel-147327

Rozenholc Y. and Tykhonov V., The Covid-19 Museum ... a use case for the Dataverse community, 8th annual Dataverse Community Meeting, Harvard, 14 to 16 June 2022.
https://www.youtube.com/watch?v=3ek7F_Dxcjk&t=3284s 

Rozenholc Y., Vion-Dury J., Petrazoller F., The Covid-19 Museum, Symposium : Collecte de la rupture ou rupture de la collecte, Science&You Conference, Metz, 16 au 19 Novembre 2021. 
https://scienceandyou2021.insight-outside.fr/fr/programme-officiel/37

Rozenholc Y., Le musée virtuel du Covid-19, Le patrimoine au temps du confinement, Journée d’études de l’Institut National du Patrimoine 29 Janvier 2021.
https://www.inp.fr/content/download/10713/158132/version/1/file/PROGRAMME.pdf

Rozenholc Y., Rencontre-débat « Une pandémie ne change rien », Festival des idées, Université Paris Cité 20 Novembre 2020. https://u-paris.fr/festival-idees-paris/une-pandemie-ne-change-rien/

Covid-19 Museum seminar organized by Rozenholc Y., Vion-Dury J., Covid-19 Museum - YouTube, https://www.youtube.com/@covid-19museum58

Other Media: The Covid-19 Museum, begun in March 2020 and released on April 2, 2020, was featured in the following press:

- 20 Minutes, April 25, 2020
- Le Point, May 3, 2020
- La Croix, May 20, 2020
- The Huffpost, May 21, 2020

- Le Journal Du Dimanche, May 24, 2020 
- We Demain, August 13, 2020
https://www.wedemain.fr/partager/les-services-darchives-memorisent-nos-vies-confinees
- Le Monde, May 16, 2021 

and the topic of interview by: 
- France 24 for CulturePrime FRANCE 24 - Le Covid-19 au musée | Facebook
- Whatsupdoc-lemag.fr N°5 https://www.whatsupdoc-lemag.fr/magazine/51",andrea-scharnhorst/readme; vyacheslav-tykhonov/readme; juliette-vion-dury/readme; yves-rozenholc/readme
Jyldyz Djumalieva,"Jyldyz Djumalieva is the head of open jobs data at Nesta. She specializes in machine learning, network analysis and the exploration of complex datasets. Prior to joining Nesta, Djumalieva was a data analyst at the Bank of England where she conducted projects involving text mining, social media analysis and graph databases. She also has a strong background in organizational consulting. At OnPoint Consulting LLC she facilitated the design and delivery of eLearning solutions for leader development. She holds an MSc with distinction in Big Data Analytics from the Sheffield Hallam University and an MSc in Organizational Psychology from the University of Hartford, CT.
",Djumalieva,https://raw.githubusercontent.com/cns-iu/scimaps/gh-pages/assets/content/person/jyldyz-djumalieva/image.jpg,,,,['maker'],,,,,,,,,,
Kalev H. Leetaru,"Kalev Leetaru founded and leads the GDELT Project, which monitors the world's broadcast, print, and web news in over 100 languages and identifies the people, locations, organizations, counts, themes, sources, emotions, narratives, and events driving global society, creating a free, open, real-time platform for computing on the entire world. One of Foreign Policy Magazine’s Top 100 Global Thinkers of 2013, he is a senior fellow at George Washington University and a Google developer expert. Previously, he was the Yahoo Fellow and adjunct faculty at Georgetown University’s School of Foreign Service and a World Economic Forum council member. His work focuses on how innovative applications of the world's largest datasets, computing platforms, algorithms, and mindsets can reimagine the way we understand and interact with our global world.",Leetaru,https://raw.githubusercontent.com/cns-iu/scimaps/gh-pages/assets/content/person/kalev-h-leetaru/image.jpg,,,,['maker'],,,"Washington, D.C., USA",,,,,,,
Katy Börner,"Katy Börner is the Victor H. Yngve Distinguished Professor of Information Science at the School of Library and Information Science, Adjunct Professor at the School of Informatics and Computing, Adjunct Professor at the Department of Statistics in the College of Arts and Sciences, Core Faculty of Cognitive Science, Research Affiliate of the Biocomplexity Institute, Fellow of the Center for Research on Learning and Technology, Member of the Advanced Visualization Laboratory, and Founding Director of the [Cyberinfrastructure for Network Science Center](http://cns.iu.edu) at Indiana University. [Learn more about Katy here](http://info.slis.indiana.edu/~katy/index.html).",Börner,https://raw.githubusercontent.com/cns-iu/scimaps/gh-pages/assets/content/person/katy-borner/image.jpg,"{""type"":""Point"",""coordinates"":[-86.51239096685244,39.17539877656838]}",,,"['maker', 'team', 'curator']",Director of the Cyberinfrastructure for Network Science Center,Indiana University - Bloomington,"Bloomington, IN, USA",,,,,,,
Keiichi Nemoto,"Keiichi Nemoto is a research scientist of Communication Technology Laboratory at Fuji Xerox, and was a visiting scholar at the MIT Center for Collective Intelligence from 2009 to 2011. He studied computer science at Keio University. In 2003, he joined Fuji Xerox and has performed research on organizational behavior. He focuses on collaboration networks through the lens of social network analysis, using Wikipedias in different languages as a topic of analysis. His research interests also include the beauty of networks, visualizing collaboration, communication, and concept networks of massive collaborative data such as Wikipedia.",Nemoto,https://raw.githubusercontent.com/cns-iu/scimaps/gh-pages/assets/content/person/keiichi-nemoto/image.jpg,,,,['maker'],,,"Toyko, Japan",,,,,,,
Keith V. Nesbitt,"Keith V. Nesbitt is a senior lecturer in the School of Design, Communication, and Information Technology at the University of Newcastle, Australia. Previously, he worked at Charles Sturt University in Bathurst. He also spent 10 years at the applied research facility of Broken Hill Proprietary Company Ltd., where he applied advanced computing technologies to a cross-section of business domains, including exploration, mining, manufacture, logistics, and finance. He studied medicine before developing an interest in computing and subsequently receiving a bachelor's degree in mathematics from the University of Newcastle and a master's in computing and a PhD in computer science from Sydney University. His doctoral work investigated new conceptual models for designing multisensory user interfaces and included the design and evaluation of visual, auditory, and haptic displays for finding patterns in stock market data. Nesbitt summarizes his work as tool building that helps people find useful patterns in data. Related to this, Nesbitt also studies how the mind works and how people create and use ideas. His current scientific interests include designing multisensory displays, perception and cognition, complex systems, software engineering, user-interface design, and conceptual modeling.",Nesbitt,https://raw.githubusercontent.com/cns-iu/scimaps/gh-pages/assets/content/person/keith-v-nesbitt/image.jpg,"{""type"":""Point"",""coordinates"":[151.7041882272292,-32.89278979868974]}",,,['ambassador'],Senior Lecturer in Information Technology,The University of Newcastle,"Callaghan, Australia",,,,,,,
Kelly Fang,"Kelly Fang is an undergraduate student at MIT exploring the intersection of technology, design, and the built environment. She is interested in the ethical applications of big data and computational techniques to urban issues and hopes to contribute to the development of algorithms and interfaces that will promote equitable and resilient cities.",Fang,https://raw.githubusercontent.com/cns-iu/scimaps/gh-pages/assets/content/person/kelly-fang/kelly-fang.png,,,,['maker'],,,"Cambridge, MA, USA",19,5,2020,Spatial Equity NYC,"Authors: Niko McGlashan, Sarah Williams, Daniela Coray, Kelly Fang, Enrique Casillas, Jari Prachasartta, Jiajie Li

Link to Macroscope: <https://www.spatialequity.nyc/>

Abstract: 

Spatial Equity NYC documents inequities in the ways that public space — including streets, sidewalks, and greenspaces — is designed, distributed, and accessed. Browse citywide data or search community profiles to learn how decisions about the use of public space lead to unequal outcomes and what you can do about it.
","- Please check back with us in the coming weeks should we be accepted to include more relevant publications and conference proceedings.

- Homepage for the Leventhal Center for Advanced Urbanism https://lcau.mit.edu/
",niko-mcglashan/readme; sarah-williams/readme; daniela-coray/readme; kelly-fang/readme; enrique-casillas/readme; jari-prachasartta/readme; jiajie-li/readme
Kevin W. Boyack,"Kevin W. Boyack holds a PhD in chemical engineering from Brigham Young University. As the president of SciTech Strategies, Inc., his work centers on developing more accurate global maps of science. He has published nearly 30 articles dealing with various aspects of science mapping and related metrics. Previously, he worked in combustion (experimental and modeling), transport processes, socioeconomic war gaming, and science mapping for 17 years at Sandia National Laboratories. Current interests include detailed mapping of the structure and dynamics of science and technology, application of full text to science mapping and bibliometrics, and the identification of emerging topics.",Boyack,https://raw.githubusercontent.com/cns-iu/scimaps/gh-pages/assets/content/person/kevin-w-boyack/image.jpg,"{""type"":""Point"",""coordinates"":[-106.65553799273782,35.085480157937745]}",,,"['maker', 'ambassador']",President,"SciTech Strategies, Inc.","Albuquerque, NM, USA",,,,,,,
Kim Albrecht,"Kim Albrecht is a visual researcher and information designer interested in networks, time, power, processes and how we can find visual representations for these topics to produce and represent knowledge. He collaborates and designs interfaces with research groups from a wide variety of scientific fields and universities at the Center for Complex Network Research. In 2016, Albrecht started his PhD research at the University of Potsdam in the field of media theory. He will be researching information visualizations and their interfaces regarding their epistemological value and how they help us to make sense of the world.",Albrecht,https://raw.githubusercontent.com/cns-iu/scimaps/gh-pages/assets/content/person/kim-albrecht/image.jpg,,,,['maker'],,,"Potsdam, Germany",,,,,,,
Kim Rees,"Kim Rees is Head of Information Visualization at Periscopic, and is a prominent individual in the data visualization community. She has presented at several industry events including Strata, OSCON, Wolfram Data Summit, VisWeek, Tableau User Conference, NY Hacks/Hackers, and Portland Data Visualization, among others. She is an advisor to the US Congressional Budget Office. Kim has published papers in Parsons Journal of Information Mapping, was an award winner in the VAST 2010 Challenge, and is a guest blogger for Infosthetics and FlowingData. Recently, she was the technical editor of Visualize This, by Nathan Yau of FlowingData. She was a judge on the WikiViz Challenge 2011 and CommArts Interactive Annual 2012.",Rees,https://raw.githubusercontent.com/cns-iu/scimaps/gh-pages/assets/content/person/kim-rees/image.jpg,,,,['maker'],,,"Portland, OR, USA",,,,,,,
Krzysztof Suchecki,"Krzysztof Suchecki obtained his MA and PhD in physics from the Warsaw University of Technology, Poland. He works at the Erasmus Studio of the Erasmus University in Rotterdam, Netherlands, specializing in complex networks and sociophysics.
",Suchecki,https://raw.githubusercontent.com/cns-iu/scimaps/gh-pages/assets/content/person/krzysztof-suchecki/image.jpg,,,,['maker'],,,"Rotterdam, Netherlands",,,,,,,
LaDale Winling,"LaDale Winling is an associate professor of history at Virginia Tech. He is the author of _Building the Ivory Tower_, on universities and urban development in the United States. It was published by the University of Pennsylvania Press and won the 2019 Kenneth Jackson Prize from the Urban History Association for best book on North American cities. He is a co-creator of “Mapping Inequality: Redlining in New Deal America,” and his latest digital history project is “Connecting the Interstates,” on displacement and redevelopment in the interstate highway system.",Winling,https://raw.githubusercontent.com/cns-iu/scimaps/gh-pages/assets/content/person/ladale-winling/image.jpg,,,,['maker'],,,"Blacksburg, VA, USA",,,,,,,
Laura Bonetta,"Laura Bonetta leads the BioInteractive program at the Howard Hughes Medical Institute (HHMI) and is an adjunct biology professor at Howard Community College in Maryland. Dr. Bonetta joined HHMI after working more than 20 years in scientific communication. After conducting research in cancer genetics, she joined the editorial team of _Nature_ magazine. She then worked as a science writer and managing editor for a wide range of print and online science journals including _Nature_, _Nature Medicine_, _Nature Genetics_, _Science_, _Cell_, _Alzforum_, and various NIH publications and websites.",Bonetta,https://raw.githubusercontent.com/cns-iu/scimaps/gh-pages/assets/content/person/laura-bonetta/image.jpg,,,,['maker'],,,"Chevy Chase, MD, USA",,,,,,,
Laura Kurgan,N/A,Kurgan,N/A,,,,['maker'],,,,19,7,2023,Mapping the New Politics of Care,"Authors: Laura Kurgan, Gregg Gonsalves, Dare Brawley, Jia Zhang, Suzan Iloglu,Thomas Thornhill, Adeline Chum, 

Link to Macroscope: <https://newpoliticsofcare.net/>

Abstract: 

Mapping the New Politics of Care displayed the effects of COVID-19 in the United States layering a wide range of social, economic, and environmental conditions on two interactive maps utilizing multiple vulnerability indexes. 

The first map, titled Community Health Workers, asked viewers to imagine what would happen if one million community workers were allocated across the USA by comparing four indexes of vulnerability alongside COVID-19 data. A user can toggle between multiple vulnerabilities for the distribution of the workers, specific to each county. Making decisions like this responsibly requires confronting and addressing not just the virus but also the inequalities and vulnerabilities that propelled the pandemic.

All people in the USA were granted the right to have access to free, safe, and effective COVID-19 vaccines over multiple federal distribution phases. But due to the limited doses available, the majority of states followed the Center for Disease Control’s recommendations to prioritize health-care personnel and long-term care facility residents in receiving the first vaccines. 

The second map titled, Vaccine Allocation, focused on this first distribution, Phase 1A of the federal program and compared how each state could have distributed 22 million doses of vaccine more equitably. Users can compare Phase 1A allocation vs allocation to vulnerable populations county by county, in each state. Prioritizing vulnerability could have mitigated health inequities and protected communities that were more likely to have the first and most concentrated COVID-19 outbreaks.

The vulnerabilities made visible in both maps predated the pandemic and created the conditions for the virus to flourish. Both maps display the acute inequalities embedded in the social and political landscape of the USA. This pandemic is not simply biological. It is a symptom of an illness in our body politic. As COVID-19 roared across the country, it followed the fault lines of social vulnerability.","Gonsalves, Gregg, and Amy Kapczynski. 2020. “The New Politics of Care.” Boston Review, April 26, 2020. http://bostonreview.net/politics/gregg-gonsalves-amy-kapczynski-new-politics-care.

Centers for Disease Control and Prevention, “COVID-19 Vaccine Distribution Allocations by Jurisdiction - Pfizer,” 2020, https://data.cdc.gov/Vaccinations/COVID-19-Vaccine-Distribution-Allocations-by-Juris/saz5-9hgg.

Centers for Disease Control and Prevention, “COVID-19 Vaccine Distribution Allocations by Jurisdiction - Moderna,” 2020, https://data.cdc.gov/Vaccinations/COVID-19-Vaccine-Distribution-Allocations-by-Juris/b7pe-5nws.

Centers for Disease Control and Prevention. 2020. “COVID-19 Hospitalization and Death by Age.” February 11, 2020. https://www.cdc.gov/coronavirus/2019-ncov/COVID-data/investigations-discovery/hospitalization-death-by-age.html.

Centers for Disease Control and Prevention, “CDC Social Vulnerability Index (SVI),” September 4, 2020, https://www.atsdr.cdc.gov/placeandhealth/svi/index.html.

Centers for Disease Control and Prevention. 2020. “Coronavirus Disease 2019 (COVID-19) 2020 Interim Case Definition, Approved August 5, 2020.” https://wwwn.cdc.gov/nndss/conditions/coronavirus-disease-2019-COVID-19/case-definition/2020/08/05/.

Centers for Medicare and Medicaid Services, “Nursing homes including rehab services, Provider Information,” 2020, https://data.cms.gov/provider-data/dataset/4pq5-n9py.

Centers for Medicare and Medicaid Services. 2020. “State Medicaid and CHIP Applications, Eligibility Determinations, and Enrollment Data, Centers for Medicare and Medicaid Services.” https://data.medicaid.gov/Enrollment/State-Medicaid-and-CHIP-Applications-Eligibility-D/n5ce-jxme.

Departamento de Salud. 2019. “Informe Anual de Estadísticas Vitales: Defunciones, años 2015 y 2016.” http://www.salud.gov.pr/Estadisticas-Registros-y-Publicaciones/Estadisticas%20Vitales/Informe%20Anual%20Estad%C3%ADsticas%20Vitales%20Defunciones%202015-2016.pdf.

New York Times. 2020. “Coronavirus (COVID-19) Data in the United States.” https://github.com/nytimes/COVID-19-data.

Remington, Patrick L., Bridget B. Catlin, and Keith P. Gennuso. 2015. “The County Health Rankings: Rationale and Methods.” Population Health Metrics 13 (1): 11. https://doi.org/10.1186/s12963-015-0044-2.

University of Wisconsin Population Health Institute and Robert Wood Johnson Foundation. 2020. “2020 County Health Rankings National Data.” https://www.countyhealthrankings.org/explore-health-rankings/rankings-data-documentation.

US Bureau of Labor Statistics. 2020. “Local Area Unemployment Statistics.” https://www.bls.gov/lau/laufaq.htm#Q01.

US Census Bureau, “American Community Survey 5-Year Data (2015–2019),” 2020, https://www.census.gov/data/developers/data-sets/acs-5year.html.

US Census Bureau, “2018 County Business Patterns,” 2020, https://www.census.gov/programs-surveys/cbp.html.

US Census Bureau. 2020. “Puerto Rico Municipios Population Totals: 2010–2019.” https://www.census.gov/data/tables/time-series/demo/popest/2010s-total-puerto-rico-municipios.html.

US Census Bureau. 2019. “American Community Survey 5-Year Data (2014–2018).” https://www.census.gov/data/developers/data-sets/acs-5year.html.

US Bureau of Labor Statistics. 2020. “Labor Force Data by County, Not Seasonally Adjusted, Latest 14 Months.” https://www.bls.gov/web/metro/laucntycur14.txt.",laura-kurgan/readme; gregg-gonsalves/readme; dare-brawley/readme; jia-zhang/readme; suzan-iloglu/readme; thomas-thornhill/readme; adeline-chum/readme
Laura Pence,"Laura Pence holds an MA in library science from the Department of Information and Library Science, School of Informatics and Computing at Indiana University. After working as a print and web designer at PenceLdesign, she became the director of creative strategy at the Indiana University School of Journalism in 2012.",Pence,https://raw.githubusercontent.com/cns-iu/scimaps/gh-pages/assets/content/person/laura-pence/image.jpg,,,,['maker'],,,"Bloomington, IN, USA",,,,,,,
Lei Shi,N/A,Shi,N/A,,,,['maker'],,,,20,7,2023,GeneticFlow: Exploring Scholar Impact with Visualization,"<!--StartFragment-->

Macroscope Link: <https://genetic-flow.com/>

GeneticFlow, our Macroscope, is intricately designed for the academic user groups at large, e.g., researchers, educators, decision-makers, or even fresh students in universities and research institutions. The tool meets an important need of academic researchers on the in-depth analysis and interpretation of scholars' impact, streamlining tasks such as scientific career analysis, academic award selection, and tenure evaluation. For junior students, it also opens a door for visually understanding the career path and biography of prestigious scientists, e.g., Turing award winners and Nobel prize laureates. Now we focus on several areas inside the computer science discipline, including AI, database, graphics, visualization, etc., but we may extend the coverage to more disciplines in near future (e.g., physics, material). 

The GeneticFlow tool mainly utilizes the comprehensive dataset provided by Microsoft Academic Graph, which encompasses an almost full coverage of academic data including papers, authors, citations, and topics, till 2021.10. At its core, the GeneticFlow tool designed a self-citation graph to visualize the evolution of a scholar’s research innovations, as well as their external impact. Cutting edge algorithms, including advisor-advisee detection, extend-type citation classification, embedding-based topic generation, and graph neural networks are employed in our tool for both effective visualization and downstream inference tasks. More details can be found in our KDD 2023, VIS 2023, and NeuroIPS 2023 papers. 

The visualization design employs a time-dependent hierarchical graph representation, further augmented with appropriate color mapping, interactive trend charts, and a topical map view, providing multidimensional insights into temporal and thematic aspects of a scholar's research contribution and impact. Through extensive case studies and quantitative evaluations, we find that the GeneticFlow visualization can highlight the key success of top-ranked scholars. It also predicts high-level award recipients (e.g., ACM fellows), with significantly better performance than classical impact indicators such as h-index, i-10 index, and citation networks.

<!--EndFragment-->","<!--StartFragment-->

Yuankai Luo, Lei Shi\*, Mufan Xu, Yuwen Ji, Fengli Xiao, Chunming Hu, Zhiguang Shan\*,“Impact-Oriented Contextual Scholar Profiling using Self-Citation Graphs”, KDD, 2023.

<!--EndFragment-->; <!--StartFragment-->

Fengli Xiao and Lei Shi*, “GeneticFlow: Exploring Scholar Impact with Interactive Visualization ”, IEEE VIS (short paper), 2023.

<!--EndFragment-->; <!--StartFragment-->

Yuankai Luo, Veronika Thost\*, and Lei Shi\*, “Transformers over Directed Acyclic Graphs”, NeurIPS, 2023.

<!--EndFragment-->",fengli-xiao/readme; ye-sun/readme; yuankai-luo/readme; lei-xia/readme; weize-wu/readme; chunming-hu/readme; lei-shi/readme
