name,Biography,last_name,creator image,location,latitude,longitude,roles,jobTitle,affiliation,location_name,iteration,sequence,year,title,body_y,references,makers
David McCandless,"David McCandless is a London-based author, data-journalist and information designer, working across print, advertising, TV and web. His design work has appeared in over forty publications internationally including The Guardian, Wired and Die Zeit. His commercial clients include Google, GE, and the BBC. His blog and book Information Is Beautiful are dedicated to visualizing ideas, issues, knowledge and data—all with the minimum of text.
",McCandless,https://raw.githubusercontent.com/cns-iu/scimaps/gh-pages/assets/content/person/david-mccandless/image.jpg,,,,['maker'],,,"London, England",,,,,,,
David N. Wiley,"David N. Wiley received his PhD in environmental studies from Antioch University with a focus on environmental decision making and conservation biology. He is an adjunct professor at the College of Science and Mathematics at the University of Massachusetts–Boston and the research coordinator for the Stellwagen Bank National Marine Sanctuary of the National Oceanic and Atmospheric Administration (NOAA). His research has ranged from studying the reproductive and foraging ecology of endangered whales to mapping toxic and hazardous marine dump sites. He is the recipient of numerous honors, including an Excellence in Scientific Communication Award from the international Society for Marine Mammalogy, an Ian Axford (Fulbright) Fellowship in Public Policy, and a U.S. Department of Commerce Gold Medal for scientific leadership. In 2012, he was profiled in the book Wildlife Heroes as one of the world’s 40 leading wildlife conservationists.",Wiley,https://raw.githubusercontent.com/cns-iu/scimaps/gh-pages/assets/content/person/david-n-wiley/image.jpg,,,,['maker'],,,"Boston, MA, USA",,,,,,,
David Newman,"David Newman received his PhD from Princeton University and was a post-doctoral scholar at the California Institute of Technology (Caltech). He is an associate researcher at the Department of Computer Science, University of California, Irvine. His research focuses on topic models as well as related text-mining and machine-learning techniques. The work is marked by a commitment to combining theoretical advances with practical applications in ways that broaden access and use for individuals and communities while improving the ways that people find, discover, analyze, and understand information.
",Newman,https://raw.githubusercontent.com/cns-iu/scimaps/gh-pages/assets/content/person/david-newman/image.jpg,,,,['maker'],,,"Irvine, CA, USA",,,,,,,
David Pescovitz,"David Pescovitz is a research director at IFTF; a writer-in-residence for the College of Engineering, including Electrical Engineering and Computer Sciences (EECS), at the University of California, Berkeley; and coeditor of the popular blog Boing Boing. Pescovitz holds a BFA in electronic media from the University of Cincinnati and an MS in journalism from the University of California, Berkeley. Pescovitz has also written for Scientific American, Popular Science, Business 2.0, The New York Times, The Washington Post, Salon, the Los Angeles Times, IEEE Spectrum, The Industry Standard, Spin, MTV (online), Interior Design, the Discovery Channel (online), Flash Art, Small Times, Britannica Online, and New Scientist, among many other publications and websites.",Pescovitz,https://raw.githubusercontent.com/cns-iu/scimaps/gh-pages/assets/content/person/david-pescovitz/image.jpg,,,,['maker'],,,"Berkeley, CA, USA",,,,,,,
David Reagan,David Reagan is a senior analyst and programmer with the Advanced Visualization Lab at Indiana University.,Reagan,https://raw.githubusercontent.com/cns-iu/scimaps/gh-pages/assets/content/person/david-reagan/image.jpg,,,,['maker'],,,"Bloomington, IN, USA",,,,,,,
David Rumsey,"David Rumsey is president of Cartography Associates, a digital publishing company based in San Francisco, and director of Luna Imaging, a provider of enterprise software for online image collections. He was a founding member of Yale Research Associates in the Arts, a group of artists working with electronic technologies. He subsequently became associate director of the American Society for Eastern Arts in San Francisco. Later, he entered a 20-year career in real estate development and finance, during which he had a long association with the General Atlantic Holding Company of New York and served as president and director of several subsidiaries. General Atlantic eventually became the Atlantic Trust, a Bermuda-based philanthropic foundation that is now one of the world's largest charities. Rumsey retired from real estate in 1995 and founded Cartography Associates, beginning a third career as a digital publisher, online library builder, and software entrepreneur.",Rumsey,https://raw.githubusercontent.com/cns-iu/scimaps/gh-pages/assets/content/person/david-rumsey/image.jpg,,,,['maker'],,,"San Francisco, CA, USA",,,,,,,
Deb Roy,"Deb Roy is a tenured member of the MIT faculty and directs the Cognitive Machines Group at the MIT Media Lab. A native of Canada, he received his BAS in computer engineering from the University of Waterloo and his PhD in cognitive science from MIT. He joined the MIT faculty in 2000 and was named AT&T Associate Professor of Media Arts and Sciences in 2003. Roy studies how children learn language and designs machines that learn to communicate in human-like ways. To enable this work, he has pioneered new data-driven methods for analyzing and modeling human linguistic and social behavior. He has authored numerous scientific papers on artificial intelligence, cognitive modeling, human–machine interaction, data mining, and information visualization. Roy’s research has been frequently featured in The New York Times, The Wall Street Journal, WIRED, National Geographic, and Science as well as on the BBC and National Public Radio.",Roy,https://raw.githubusercontent.com/cns-iu/scimaps/gh-pages/assets/content/person/deb-roy/image.jpg,,,,['maker'],,,"Cambridge, MA, USA",,,,,,,
Devin Becker,"Devin Becker holds a BA from Williams College, an MLS from Indiana University, and an MFA in English from the University of California at Irvine. He works as digital initiatives and scholarly communications librarian at the University of Idaho. Becker is also a codesigner of Literary Empires: Mapping Temporal and Spatial Settings of Victorian Poetry. Becker’s poetry appears in Cutbank, Prairie Schooner, and Faultline, among other journals, and his tutorials on cleaning and mapping Wikileaks data with Google Fusion Tables have been published in the online journal Spatial Humanities Step by Step.
",Becker,https://raw.githubusercontent.com/cns-iu/scimaps/gh-pages/assets/content/person/devin-becker/image.jpg,,,,['maker'],,,"Moscow, ID, USA",,,,,,,
Dietmar Offenhuber,"Dietmar Offenhuber holds an MS in architecture from the Vienna University of Technology and an MS in media arts and sciences from the MIT Media Lab. He was a founding member of the Ars Electronica Futurelab. From 2009 to 2010, he worked as a professor at the University of Arts Linz and as a researcher at the Ludwig Boltzmann Institute Media.Art.Research. in Linz, Austria. In 2009, he joined MIT’s SENSEable City Lab as a PhD student and research fellow with a deep interest in the spatial concepts of cognition, representation, and behavior.",Offenhuber,https://raw.githubusercontent.com/cns-iu/scimaps/gh-pages/assets/content/person/dietmar-offenhuber/image.jpg,,,,['maker'],,,"Cambridge, MA, USA",,,,,,,
Dimitris Menemenlis,"Dimitris Menemenlis is a research scientist at the Jet Propulsion Laboratory (JPL). His research interests pertain to studies of the global ocean circulation and its interaction with land ice, sea ice, and biogeochemical cycles; the utilization and interpretation of satellite and in-situ ocean and sea ice data; and the development and application of parameterizations and data assimilation strategies for the Massachusetts Institute of Technology general circulation model (MITgcm). Among various projects, Menemenlis leads Estimating the Circulation and Climate of Ocean-Ice interactions in Earth System models (ECCO-IcES) and is a member of Carbon Monitoring System Flux estimation and attribution (CMS-Flux).
",Menemenlis,https://raw.githubusercontent.com/cns-iu/scimaps/gh-pages/assets/content/person/dimitris-menemenlis/image.jpg,,,,['maker'],,,"La Cañada Flintridge, CA, USA",,,,,,,
Dino Citraro,"Dino Citraro is Head of Strategic Design and Operations at Periscopic, and has a strong background in problem solving, creative direction, and writing. A sixteen-year veteran of the multimedia industry, his work has spanned traditional websites, interactive motion pictures, multi-player online games, immersive data visualizations, and interactive hardware installations. He is the Visualization Editor of the Big Data journal, as well as a contributing blogger to several industry sites. He is also an accomplished photographer, a published poet, and has written and illustrated seven children's books.
",Citraro,https://raw.githubusercontent.com/cns-iu/scimaps/gh-pages/assets/content/person/dino-citraro/image.jpg,,,,['maker'],,,"Portland, OR, USA",,,,,,,
Domanique Alicia,"Dominique Alicia is Principal & Interactive Designer at Whitten & Burr.
",Alicia,https://raw.githubusercontent.com/cns-iu/scimaps/gh-pages/assets/content/person/domanique-alicia/image.jpg,,,,['maker'],,,,,,,,,,
Donna J. Cox,,Cox,https://raw.githubusercontent.com/cns-iu/scimaps/gh-pages/assets/content/person/donna-j-cox/image.jpg,"{""type"":""Point"",""coordinates"":[-88.22704546843802,40.10213801714853]}",,,"['ambassador', 'advisory_board']",Director of the Advanced Visualization Laboratory at the National Center for Supercomputing Applications,University of Illinois at Urbana-Champaign,"Urbana, Il, USA",,,,,,,
Doris Duanmu,"Doris Duanmu is an architect, urbanist, educator, and completed the SMArchS Urbanism program at MIT.  Her research incorporates personal narratives to interrogate the designer’s role in socially, culturally, and politically produced architectural and urban agendas. Previously, she received a BArch degree from the University of Southern California and worked at several renowned offices on international projects, including the new Everton Stadium at Bramley-Moore Dock.",Duanmu,https://raw.githubusercontent.com/cns-iu/scimaps/gh-pages/assets/content/person/doris-duanmu/doris-duanmu.png,,,,['maker'],,,"Cambridge, MA, USA",,,,,,,
Ece Kavlak,"Ece Kavlak worked as a senior project manager at Interactive Things. She holds an MS in automotive systems engineering from the Rheinisch-Westfälische Technische Hochschule Aachen. Her work centers around advocating smart solutions by connecting creativity with economics to create value for people and businesses alike. Kavlak is passionate about homing in on a project’s vision which turns into a shared understanding of what we do, how we do it, and why we’re doing it.
",Kavlak,https://raw.githubusercontent.com/cns-iu/scimaps/gh-pages/assets/content/person/ece-kavlak/image.jpg,,,,['maker'],,,"Zürich, Switzerland",,,,,,,
E.C.M. (Ed) Noijons,N/A,Noijons,https://raw.githubusercontent.com/cns-iu/scimaps/gh-pages/assets/content/person/ecm-ed-noijons/image.jpg,"{""type"":""Point"",""coordinates"":[4.475818769721159,52.16869929247168]}",,,['ambassador'],Senior Researcher,CWTS Leiden University,"Leiden, Netherlands",,,,,,,
Edith M. Punt,"Edith M. Punt graduated from McGill University in Montreal with a BSc in physical geography and Northern studies. After an apprenticeship in cartography with Nunavik Graphics in Montreal, she went on to the College of Geographic Sciences in Nova Scotia, where she earned a diploma in cartography, and was recognized by the Nova Scotia House of Assembly for outstanding achievement in cartography. She was the recipient of the Nicholson Cartographic Scholarship in 1995 and the President's Prize for Best Colour Map in 1996—both from the Canadian Cartographic Association. In 1996 she also won the National Geographic Society Award in Cartography and the Intergraph Award in Computer Cartography from the Canadian Institute of Geomatics. She has been a cartographer and writer at ESRI in Redlands, California, since 1996.",Punt,https://raw.githubusercontent.com/cns-iu/scimaps/gh-pages/assets/content/person/edith-m-punt/image.jpg,,,,['maker'],,,"Redlands, CA, USA",,,,,,,
Edmund Talley,"Edmund (Ned) Talley received his PhD in neuroscience from the University of Virginia. He is a program director for basic research in synaptic transmission at the National Institute of Neurological Disorders and Stroke, part of the National Institutes of Health (NIH). His interest in textual analysis and visual analytics initially resulted from NIH strategic planning efforts in which the need for better analytic tools for assessing NIH funding became apparent.
",Talley,https://raw.githubusercontent.com/cns-iu/scimaps/gh-pages/assets/content/person/edmund-talley/image.jpg,,,,['maker'],,,"Bethesda, MD, USA",,,,,,,
Electronic Frontier Foundation,"The Electronic Frontier Foundation describes itself as the leading nonprofit organization defending civil liberties in the digital world. Founded in 1990, EFF champions user privacy, free expression, and innovation through impact litigation, policy analysis, grassroots activism, and technology development. EFF's mission is to ensure that technology supports freedom, justice, and innovation for all people of the world.",Electronic,https://raw.githubusercontent.com/cns-iu/scimaps/gh-pages/assets/content/person/electronic-frontier-foundation/image.jpg,,,,['maker'],,,"San Francisco, CA, USA",,,,,,,
Elijah Meeks,"Elijah Meeks is the digital humanities specialist in Stanford University Library. His work has included design, software development and data modeling for projects such as the Digital Gazetteer of the Song Dynasty and Kindred Britain.
",Meeks,https://raw.githubusercontent.com/cns-iu/scimaps/gh-pages/assets/content/person/elijah-meeks/image.jpg,"{""type"":""Point"",""coordinates"":[-122.02859732371921,36.97417586599572]}",,,"['maker', 'advisory_board']",Chief Visualization Officer & Co-Founder,Noteable,"Santa Cruz, CA, USA",,,,,,,
Elisha F. H. Allgood,"Elisha F. H. Allgood (formerly Hardy) holds a BA in fine arts and an MA in human computer interaction design from Indiana University. She was a member of the Cyberinfrastructure for Network Science Center, led by Katy Börner, and a graduate student in human–computer interaction design at IU’s School of Informatics and Computing when she designed this map. Currently, she is based in New York as the lead user experience (UX) designer for science curriculum at Wireless Generation, a company dedicated to improving education and technology’s use in education. She enjoys solving the challenging problems of teaching complex science concepts to students while integrating technology into the classroom.
",Allgood,https://raw.githubusercontent.com/cns-iu/scimaps/gh-pages/assets/content/person/elisha-f-h-allgood/image.jpg,,,,['maker'],,,"New York, NY, USA",,,,,,,
Enrique Casillas,"Enrique Casillas is an incoming graduate student at MIT studying computer science and engineering, with an interest in using data, software, and visualization to improve cities and urban life. Casillas has worked on designing and implementing several full-stack web applications that visualize data in order to shed light on a variety of different issues. He is invested in using his background as a software engineer to improve the development and quality of data projects for the public good.",Casillas,https://raw.githubusercontent.com/cns-iu/scimaps/gh-pages/assets/content/person/enrique-casillas/enrique-casillas.png,,,,['maker'],,,"Cambridge, MA, USA",19,5,2020,Spatial Equity NYC,"Authors: Niko McGlashan, Sarah Williams, Daniela Coray, Kelly Fang, Enrique Casillas, Jari Prachasartta, Jiajie Li

Link to Macroscope: <https://www.spatialequity.nyc/>

Abstract: 

Spatial Equity NYC documents inequities in the ways that public space — including streets, sidewalks, and greenspaces — is designed, distributed, and accessed. Browse citywide data or search community profiles to learn how decisions about the use of public space lead to unequal outcomes and what you can do about it.
","- Please check back with us in the coming weeks should we be accepted to include more relevant publications and conference proceedings.

- Homepage for the Leventhal Center for Advanced Urbanism https://lcau.mit.edu/
",niko-mcglashan/readme; sarah-williams/readme; daniela-coray/readme; kelly-fang/readme; enrique-casillas/readme; jari-prachasartta/readme; jiajie-li/readme
Eric Fischer,"Eric Fischer is a data artist and software developer currently residing in Oakland, California. He holds a bachelor’s degree in linguistics from the University of Chicago. Over the course of his career, Fischer has served as a software engineer on the Android team at Google and was artist in residence at the Exploratorium in San Francisco. Currently, he creates innovative data visualizations for Mapbox, a mapping platform for developers. Fischer’s maps have been shown at the Museum of Modern Art and featured in many publications, including Wired, Popular Science, and Best American Infographics.
",Fischer,https://raw.githubusercontent.com/cns-iu/scimaps/gh-pages/assets/content/person/eric-fischer/image.jpg,,,,['maker'],,,"Oakland, CA, USA",,,,,,,
Eric Rodenbeck,N/A,Rodenbeck,https://raw.githubusercontent.com/cns-iu/scimaps/gh-pages/assets/content/person/eric-rodenbeck/image.jpg,"{""type"":""Point"",""coordinates"":[-122.26392650174769,37.810993341852374]}",,,['ambassador'],Founder and Creative Director of Stamen and member of the Board of Directors,Kenneth Rainin Foundationn,"Oakland, CA, USA",,,,,,,
Esteban Moro,"Esteban Moro is a researcher, data scientist, and associate professor at MIT Connection Science and Universidad Carlos III (UC3M) in Spain. He has published extensively throughout his career in major scholarly journals and top media outlets, and he has led many projects funded by government agencies and/or private companies. Moro's work lies at the intersection of big data and computational social science, with special attention to human dynamics, collective intelligence, social networks, and urban mobility in problems like viral marketing, natural disaster management, or economical segregation in cities. He has received numerous awards for his research, including the “Shared University Award” from IBM in 2007 and the “Excellence in Research” Awards in 2013 and 2015 from UC3M.",Moro,https://raw.githubusercontent.com/cns-iu/scimaps/gh-pages/assets/content/person/esteban-moro/moro_esteban.png,,,,['maker'],,,"Madrid, Spain",18,1,2022,Atlas of Inequality,"Authors: Esteban Moro

Link to Macoscope: [Inequality.media.mit.edu](http://inequality.media.mit.edu) 

Abstract: 

Economic inequality isn't just limited to neighborhoods. The restaurants, stores, and other places we visit in cities are all unequal in their own way.

The Atlas of Inequality shows the income inequality of people who visit different places in cities around the U.S. It uses aggregated anonymous location data from digital devices to estimate people's incomes and where they spend their time.

Using that data, we've made our own place inequality metric to capture how unequal the incomes of visitors to each place are. Economic inequality isn't just limited to neighborhoods, it's part of the places you visit every day.",<https://www.nature.com/articles/s41467-021-24899-8>,esteban-moro/readme
Esther Shyu,"Esther Shyu is a scientist and editor with several years of experience in educational technology. She leads the development of a variety of multimedia resources and serves as the editorial manager for the team. Esther earned her PhD in a joint program between the Massachusetts Institute of Technology and the Woods Hole Oceanographic Institution. Her research focused on developing mathematical population models to tackle a variety of ecological and evolutionary analyses. Prior to joining HHMI, she spent three years as a science curriculum designer for IXL Learning, a Bay Area edtech company that specializes in K-12 education.",Shyu,https://raw.githubusercontent.com/cns-iu/scimaps/gh-pages/assets/content/person/esther-shyu/image.jpg,,,,['maker'],,,"Chevy Chase, MD, USA",,,,,,,
Ethan Goldstine,"Ethan Goldstine is a co-founder of kapow, inc. His creative ideas and understanding of technology have contributed to the success of the company's numerous projects. An observer of trends in new media and beyond, his counsel helps kapow's clients evaluate current technology and plan for the future. Goldstine began developing websites in 1995, founding the site for NPR affiliate KCRW and, with Neal Steinberg, co-creating a groundbreaking online detective story. He has also worked in computer consulting and training as well as in film production and development. He is a graduate of Yale University.",Goldstine,https://raw.githubusercontent.com/cns-iu/scimaps/gh-pages/assets/content/person/ethan-goldstine/image.jpg,,,,['maker'],,,"Los Angeles, CA, USA",,,,,,,
Eugene Chen,"Eugene Chen is a director at Darkhorse Analytics and creates interactive visualizations.  Shortlisted for a number of Information is Beautiful awards, he enjoys combining his creativity, coding, and design in creating memorable and accessible tools.  A consistent innovator, Chen has also presented and taught workshops at various post-secondary institutions and conferences, including OpenVisConf, IEEE Vis, and multiple Canadian Open Data Summits.  Active in the open data and civic tech community, Eugene is a founding director of the Canadian Open Data Society and a civic advisor on the city of Edmonton’s Open Data Citizen Advisory Committee.
",Chen,https://raw.githubusercontent.com/cns-iu/scimaps/gh-pages/assets/content/person/eugene-chen/image.jpg,,,,['maker'],,,"Edmonton, AB, Canada",,,,,,,
Eugene Garfield,"Eugene Garfield is chairman emeritus of the Institute for Scientific Information (ISI) of Thomson Reuters. He received an SB in chemistry, an MS in library science from Columbia University, and a PhD in structural linguistics from the University of Pennsylvania. He is a pioneer in information retrieval systems and inventor of Current Contents, Index Chemicus, Science Citation Index, and Arts and Humanities Citation Index. He is an eclectic science communicator, founding publisher/editor of The Scientist, author of more than 1,000 articles and books, and developer of HistCite. Garfield serves on the editorial boards of Scientometrics and the Journal of Information Science & Technology and is past president of the American Society for Information Science and Technology.",Garfield,https://raw.githubusercontent.com/cns-iu/scimaps/gh-pages/assets/content/person/eugene-garfield/image.jpg,,,,['maker'],,,"Toronto, Canada",,,,,,,
Evelyn Münster,"Evelyn Münster studied media art at the Academy of Visual Arts Leipzig in Germany. Since 2000, she has worked as a Java web applications software developer on various projects involving enterprise content management systems, document and knowledge management systems, social software, and information visualization. In 2008, she became a visualization researcher at the Ludwig Boltzmann Institute Media.Art.Research.",Münster,https://raw.githubusercontent.com/cns-iu/scimaps/gh-pages/assets/content/person/evelyn-munster/image.jpg,,,,['maker'],,,"Linz, Austria",,,,,,,
Fabian de Kok-Mercado,"Fabian de Kok-Mercado’s award-winning biomedical visualizations have appeared in a myriad of publications, films, and interactives. He is creative director within the Department of Science Education at the Howard Hughes Medical Institute, where he manages the production of science and medical visualization media. He is also an adjunct assistant professor within the Medical and Biological Illustration Graduate Program at the Johns Hopkins University School of Medicine, a certified medical illustrator, and a fellow of the Association of Medical Illustrators. 
",Kok-Mercado,https://raw.githubusercontent.com/cns-iu/scimaps/gh-pages/assets/content/person/fabian-de-kok-mercado/image.jpg,,,,['maker'],,,"Chevy Chase, MD, USA",,,,,,,
Félix de Moya Anegón,"Félix de Moya Anegón is research professor at the Institute of Public Goods and Policies (IPP) from the Spanish National Research Council (CSIC). His academic interests include scientometrics, bibliometrics, research evaluation, and science policy, and he has published around 100 papers in these fields. He is SCImago Research Group’s main researcher, where he has led renowned bibliometric projects including SCImago Journal & Country Rank, SCImago Institution Rankings, and The Atlas of Science. De Moya is also an advisor on science policy issues for national organizations of science and technology and research institutions around the world.",Anegón,https://raw.githubusercontent.com/cns-iu/scimaps/gh-pages/assets/content/person/felix-de-moya-anegon/image.jpg,,,,['maker'],,,"Madrid, Spain",,,,,,,
